{
  "app_type": "e-commerce web application",
  "expected_users": 100000,
  "traffic_pattern": "steady",
  "availability": "high",
  "storage": ["relational"],
  "performance": "standard",
  "security_compliance": ["encryption at rest", "encryption in transit", "IAM least privilege"],
  "budget_sensitivity": "moderate",
  "assumptions": ["100,000 users interpreted as monthly active users"]
}
